{
  "schema_version": "1.0",
  "wave_id": "WAVE-001",
  "source_paths": [
    "scripts/generate-wave-contracts.mjs",
    "product-structure/screens.json",
    "product-structure/component-requirements.json",
    "product-structure/flows.json",
    "product-structure/notifications.json",
    "product-structure/permissions.json",
    "product-structure/state-matrix.json",
    "product-structure/sync-model.json",
    "data/scenario-fixtures.json",
    "data/events.json",
    "data/operation.json",
    "scenarios/scenarios.json",
    "workflow-model/decisions.json",
    "workflow-model/records.json",
    "design-system/tokens/vineyard.tokens.json",
    "design-system/tokens/vineyard.css",
    "atlas/src/App.tsx",
    "atlas/src/main.tsx",
    "atlas/src/styles.css",
    "atlas/src/components/AtlasShell.tsx",
    "atlas/src/components/Icon.tsx",
    "atlas/src/components/production/componentRegistry.ts",
    "atlas/src/components/production/PublicComponent.tsx",
    "atlas/src/components/production/PublicComponents.tsx",
    "atlas/src/components/production/types.ts",
    "atlas/src/data/canonical.ts",
    "atlas/src/data/catalog.ts",
    "atlas/src/data/prototypes.ts",
    "atlas/src/data/screenViewModel.ts",
    "atlas/src/data/wave001.ts",
    "atlas/src/pages/ProductionScreenPage.tsx",
    "atlas/src/pages/PrototypePage.tsx"
  ],
  "captures": [
    {
      "id": "CAP-W001-001",
      "screen_id": "SCR-001",
      "route": "/screens/SCR-001?state=normal&fixture=FIX-002",
      "state": "normal",
      "fixture_id": "FIX-002",
      "viewport": { "name": "desktop", "width": 1440, "height": 1024 },
      "status": "complete",
      "artifact_path": "validation/wave-001-renders/primary/cap-w001-001.png",
      "metadata_path": "validation/wave-001-renders/primary/cap-w001-001.capture.json",
      "artifact_sha256": "116b0fb86b1d4ed5eb20a1ebca4f393cad0b6c4f006ab0dc47a6c25c59e4e416",
      "source_digest": "ba382990300d26ba7abaeb5b7b82b4bb559ef39bcbcc783825b73c1052a013ab",
      "generated_at": "2026-07-14T07:31:56.035Z",
      "commit_sha": "70d155821a951688c63bb92df3a61720b83bd254"
    },
    {
      "id": "CAP-W001-002",
      "screen_id": "SCR-001",
      "route": "/screens/SCR-001?state=normal&fixture=FIX-002",
      "state": "normal",
      "fixture_id": "FIX-002",
      "viewport": { "name": "mobile", "width": 390, "height": 844 },
      "status": "complete",
      "artifact_path": "validation/wave-001-renders/primary/cap-w001-002.png",
      "metadata_path": "validation/wave-001-renders/primary/cap-w001-002.capture.json",
      "artifact_sha256": "d15d53938888f78364016fe2354bf41410c6a26755c3ff65f9168ded0f7dc1b4",
      "source_digest": "ba382990300d26ba7abaeb5b7b82b4bb559ef39bcbcc783825b73c1052a013ab",
      "generated_at": "2026-07-14T07:32:03.591Z",
      "commit_sha": "70d155821a951688c63bb92df3a61720b83bd254"
    },
    {
      "id": "CAP-W001-003",
      "screen_id": "SCR-002",
      "route": "/screens/SCR-002?state=normal&fixture=FIX-002",
      "state": "normal",
      "fixture_id": "FIX-002",
      "viewport": { "name": "desktop", "width": 1440, "height": 1024 },
      "status": "complete",
      "artifact_path": "validation/wave-001-renders/primary/cap-w001-003.png",
      "metadata_path": "validation/wave-001-renders/primary/cap-w001-003.capture.json",
      "artifact_sha256": "dbf7134bf967fea1e900d84ab7498dafd61f038c8ae0342661a532d57f410a7e",
      "source_digest": "ba382990300d26ba7abaeb5b7b82b4bb559ef39bcbcc783825b73c1052a013ab",
      "generated_at": "2026-07-14T07:31:56.035Z",
      "commit_sha": "70d155821a951688c63bb92df3a61720b83bd254"
    },
    {
      "id": "CAP-W001-004",
      "screen_id": "SCR-002",
      "route": "/screens/SCR-002?state=normal&fixture=FIX-002",
      "state": "normal",
      "fixture_id": "FIX-002",
      "viewport": { "name": "mobile", "width": 390, "height": 844 },
      "status": "complete",
      "artifact_path": "validation/wave-001-renders/primary/cap-w001-004.png",
      "metadata_path": "validation/wave-001-renders/primary/cap-w001-004.capture.json",
      "artifact_sha256": "60dc599af5fb7162d561571a6fddde576c1064ddc2296f8f806cfa900912b52e",
      "source_digest": "ba382990300d26ba7abaeb5b7b82b4bb559ef39bcbcc783825b73c1052a013ab",
      "generated_at": "2026-07-14T07:32:03.591Z",
      "commit_sha": "70d155821a951688c63bb92df3a61720b83bd254"
    },
    {
      "id": "CAP-W001-005",
      "screen_id": "SCR-003",
      "route": "/screens/SCR-003?state=normal&fixture=FIX-002",
      "state": "normal",
      "fixture_id": "FIX-002",
      "viewport": { "name": "desktop", "width": 1440, "height": 1024 },
      "status": "complete",
      "artifact_path": "validation/wave-001-renders/primary/cap-w001-005.png",
      "metadata_path": "validation/wave-001-renders/primary/cap-w001-005.capture.json",
      "artifact_sha256": "abbd750ba383d89def819431a7a70491e2647a98a294ee344bc986830f84f127",
      "source_digest": "ba382990300d26ba7abaeb5b7b82b4bb559ef39bcbcc783825b73c1052a013ab",
      "generated_at": "2026-07-14T07:31:56.035Z",
      "commit_sha": "70d155821a951688c63bb92df3a61720b83bd254"
    },
    {
      "id": "CAP-W001-006",
      "screen_id": "SCR-003",
      "route": "/screens/SCR-003?state=normal&fixture=FIX-002",
      "state": "normal",
      "fixture_id": "FIX-002",
      "viewport": { "name": "mobile", "width": 390, "height": 844 },
      "status": "complete",
      "artifact_path": "validation/wave-001-renders/primary/cap-w001-006.png",
      "metadata_path": "validation/wave-001-renders/primary/cap-w001-006.capture.json",
      "artifact_sha256": "d597c40b40133745a6d71bdafd7b10547f9ba7774fe61e73b7400007f59dd8f3",
      "source_digest": "ba382990300d26ba7abaeb5b7b82b4bb559ef39bcbcc783825b73c1052a013ab",
      "generated_at": "2026-07-14T07:32:09.416Z",
      "commit_sha": "70d155821a951688c63bb92df3a61720b83bd254"
    },
    {
      "id": "CAP-W001-007",
      "screen_id": "SCR-004",
      "route": "/screens/SCR-004?state=normal&fixture=FIX-002",
      "state": "normal",
      "fixture_id": "FIX-002",
      "viewport": { "name": "desktop", "width": 1440, "height": 1024 },
      "status": "complete",
      "artifact_path": "validation/wave-001-renders/primary/cap-w001-007.png",
      "metadata_path": "validation/wave-001-renders/primary/cap-w001-007.capture.json",
      "artifact_sha256": "4d68a6d4dc8c3b567f9c9ec82cec5b10168ec2abe09177f9d5f1c7ea46a07fd9",
      "source_digest": "ba382990300d26ba7abaeb5b7b82b4bb559ef39bcbcc783825b73c1052a013ab",
      "generated_at": "2026-07-14T07:31:56.033Z",
      "commit_sha": "70d155821a951688c63bb92df3a61720b83bd254"
    },
    {
      "id": "CAP-W001-008",
      "screen_id": "SCR-004",
      "route": "/screens/SCR-004?state=normal&fixture=FIX-002",
      "state": "normal",
      "fixture_id": "FIX-002",
      "viewport": { "name": "mobile", "width": 390, "height": 844 },
      "status": "complete",
      "artifact_path": "validation/wave-001-renders/primary/cap-w001-008.png",
      "metadata_path": "validation/wave-001-renders/primary/cap-w001-008.capture.json",
      "artifact_sha256": "a36b59fc386e0bfdc46a67be37547be74b8aac4e20619d901e6ada88821aa756",
      "source_digest": "ba382990300d26ba7abaeb5b7b82b4bb559ef39bcbcc783825b73c1052a013ab",
      "generated_at": "2026-07-14T07:32:09.416Z",
      "commit_sha": "70d155821a951688c63bb92df3a61720b83bd254"
    },
    {
      "id": "CAP-W001-009",
      "screen_id": "SCR-005",
      "route": "/screens/SCR-005?state=normal&fixture=FIX-002",
      "state": "normal",
      "fixture_id": "FIX-002",
      "viewport": { "name": "mobile", "width": 390, "height": 844 },
      "status": "complete",
      "artifact_path": "validation/wave-001-renders/primary/cap-w001-009.png",
      "metadata_path": "validation/wave-001-renders/primary/cap-w001-009.capture.json",
      "artifact_sha256": "1a00a76815306c45e93a6e59f1fee5c720f5e91d703b72319bb23150bda081c2",
      "source_digest": "ba382990300d26ba7abaeb5b7b82b4bb559ef39bcbcc783825b73c1052a013ab",
      "generated_at": "2026-07-14T07:32:09.416Z",
      "commit_sha": "70d155821a951688c63bb92df3a61720b83bd254"
    },
    {
      "id": "CAP-W001-010",
      "screen_id": "SCR-006",
      "route": "/screens/SCR-006?state=normal&fixture=FIX-004",
      "state": "normal",
      "fixture_id": "FIX-004",
      "viewport": { "name": "desktop", "width": 1440, "height": 1024 },
      "status": "complete",
      "artifact_path": "validation/wave-001-renders/primary/cap-w001-010.png",
      "metadata_path": "validation/wave-001-renders/primary/cap-w001-010.capture.json",
      "artifact_sha256": "46cfc26085ace70aff0818ffd08fd4035b067f5e1532eaad743714a96c43e7f6",
      "source_digest": "ba382990300d26ba7abaeb5b7b82b4bb559ef39bcbcc783825b73c1052a013ab",
      "generated_at": "2026-07-14T07:31:56.033Z",
      "commit_sha": "70d155821a951688c63bb92df3a61720b83bd254"
    },
    {
      "id": "CAP-W001-011",
      "screen_id": "SCR-006",
      "route": "/screens/SCR-006?state=normal&fixture=FIX-004",
      "state": "normal",
      "fixture_id": "FIX-004",
      "viewport": { "name": "mobile", "width": 390, "height": 844 },
      "status": "complete",
      "artifact_path": "validation/wave-001-renders/primary/cap-w001-011.png",
      "metadata_path": "validation/wave-001-renders/primary/cap-w001-011.capture.json",
      "artifact_sha256": "47d44ced8aed6148d3cd3801f85d6a99db2b4cd1a379e4eb7d5de5cc82efbfb5",
      "source_digest": "ba382990300d26ba7abaeb5b7b82b4bb559ef39bcbcc783825b73c1052a013ab",
      "generated_at": "2026-07-14T07:32:09.311Z",
      "commit_sha": "70d155821a951688c63bb92df3a61720b83bd254"
    },
    {
      "id": "CAP-W001-012",
      "screen_id": "SCR-039",
      "route": "/screens/SCR-039?state=normal&fixture=FIX-032",
      "state": "normal",
      "fixture_id": "FIX-032",
      "viewport": { "name": "desktop", "width": 1440, "height": 1024 },
      "status": "complete",